"Product Id","Seller Id","Product Title","Current Price","Original price","Discount","Orders","Product Image","Product Link","Product rate","Product Stars"
"4000170242641","118782028","LIGE Business Men Watch Luxury Brand Blue Stainless Steel Wrist Watch Chronograph Army Military Quartz Watches Relogio Masculino","US $15.29","US $169.90","91","877","//ae01.alicdn.com/kf/Hd2063590db924ee6b03ffdb8116b256a4.jpg_350x350.jpg","//aliexpress.ru/item/4000170242641.html?pdp_ext_f=%7B%22sku_id%22:%2210000006040738765%22,%22ship_from%22:%22ES%22%7D&gps-id=5547572&scm=1007.19201.130907.0&scm_id=1007.19201.130907.0&scm-url=1007.19201.130907.0&pvid=55f97fd7-33ad-4c94-bf50-b750cf815620","0.0","4.9"
"32871715184","232071719","CURREN Fashion Date Quartz Men Watches Top Brand Luxury Male Clock Chronograph Sport Mens Wrist Watch Hodinky Relogio Masculino","US $16.95","US $211.90","92","2487","//ae01.alicdn.com/kf/He6757412a092428f916377692327e6baN.jpg_350x350.jpg","//aliexpress.ru/item/32871715184.html?pdp_ext_f=%7B%22sku_id%22:%2210000011318547666%22,%22ship_from%22:%22%22%7D&gps-id=5547572&scm=1007.19201.130907.0&scm_id=1007.19201.130907.0&scm-url=1007.19201.130907.0&pvid=55f97fd7-33ad-4c94-bf50-b750cf815620","0.0","4.8"
"33043670444","237803089","2021 Classic Women Rose Gold Top Brand Luxury Laides Dress Business Fashion Casual Waterproof Watches Quartz Calendar Wristwatch","US $15.29","US $169.90","91","133","//ae01.alicdn.com/kf/H6c5d788ee3c44adbad9c39966c710c49I.jpg_350x350.jpg","//aliexpress.ru/item/33043670444.html?pdp_ext_f=%7B%22sku_id%22:%2267424132725%22,%22ship_from%22:%22%22%7D&gps-id=5547572&scm=1007.19201.130907.0&scm_id=1007.19201.130907.0&scm-url=1007.19201.130907.0&pvid=55f97fd7-33ad-4c94-bf50-b750cf815620","0.0","4.8"
"32993322685","221595207","2021 LIGE New Rose Gold Women Watch Business Quartz Watch Ladies Top Brand Luxury Female Wrist Watch Girl Clock Relogio Feminin","US $19.79","US $219.90","91","64","//ae01.alicdn.com/kf/H0475a8d957c84bb89eeab919d8f2bd52b.jpg_350x350.jpg","//aliexpress.ru/item/32993322685.html?pdp_ext_f=%7B%22sku_id%22:%2266884874641%22,%22ship_from%22:%22%22%7D&gps-id=5547572&scm=1007.19201.130907.0&scm_id=1007.19201.130907.0&scm-url=1007.19201.130907.0&pvid=55f97fd7-33ad-4c94-bf50-b750cf815620","0.0","4.7"
"33062999979","237585399","Couple Watch NAVIFORCE Mens Watch Simple Luxury Quartz Wristwatch women Clock for Male Female Waterproof Lovers Thin Watch 2021","US $15.29","US $169.90","91","66","//ae01.alicdn.com/kf/HTB1uOzUXVY7gK0jSZKzq6yikpXa4.jpg_350x350.jpg","//aliexpress.ru/item/33062999979.html?pdp_ext_f=%7B%22sku_id%22:%2210000000020254127%22,%22ship_from%22:%22%22%7D&gps-id=5547572&scm=1007.19201.130907.0&scm_id=1007.19201.130907.0&scm-url=1007.19201.130907.0&pvid=55f97fd7-33ad-4c94-bf50-b750cf815620","0.0","4.9"
"1005002617075759","229837500","2021 genuine Ailang new men's watch Mechanical masculine and waterproof automatic man watch with leather strap and calendar","US $54.90","US $610.00","91","62","//ae01.alicdn.com/kf/H21e0e5a473044585beb249aa9ac64779B.jpg_350x350.jpg","//aliexpress.ru/item/1005002617075759.html?pdp_ext_f=%7B%22sku_id%22:%2212000021414988906%22,%22ship_from%22:%22%22%7D&gps-id=5547572&scm=1007.19201.130907.0&scm_id=1007.19201.130907.0&scm-url=1007.19201.130907.0&pvid=55f97fd7-33ad-4c94-bf50-b750cf815620","0.0","5.0"
"1005001688547421","243383831","DOOPAI Multicolor Genuine Leather Men's Belts Fashion Business Automatic Buckle Straps Ratchet Cow Leather Waistband 3.5cm Width","US $8.39","US $83.90","90","215","//ae01.alicdn.com/kf/H43f104baa6f24c31b8d392a1844a47c3F.jpg_350x350.jpg","//aliexpress.ru/item/1005001688547421.html?pdp_ext_f=%7B%22sku_id%22:%2212000017140341691%22,%22ship_from%22:%22CN%22%7D&gps-id=5547572&scm=1007.19201.130907.0&scm_id=1007.19201.130907.0&scm-url=1007.19201.130907.0&pvid=55f97fd7-33ad-4c94-bf50-b750cf815620","0.0","4.7"
"1005002278559871","248285832","LIGE New Smart Watch Men And Women Sports watch Blood pressure Sleep Monitoring Fitness tracker Android ios pedometer Smartwatch","US $22.49","US $124.95","82","1260","//ae01.alicdn.com/kf/H3aee6c3b30ff440190031a33364091997.jpg_350x350.jpg","//aliexpress.ru/item/1005002278559871.html?pdp_ext_f=%7B%22sku_id%22:%2212000019885563965%22,%22ship_from%22:%22CN%22%7D&gps-id=5547572&scm=1007.19201.130907.0&scm_id=1007.19201.130907.0&scm-url=1007.19201.130907.0&pvid=55f97fd7-33ad-4c94-bf50-b750cf815620","0.0","4.6"
"1005002278422141","240395744","LIGE 2021 Fashion Smart Watch Ladies Heart Rate Blood Pressure Multifunctional Sport Watch Men Woman Waterproof Smartwatch Women","US $22.09","US $129.95","83","2187","//ae01.alicdn.com/kf/H8cb73a8344f14b8f8fcfa275390c65cfg.jpg_350x350.jpg","//aliexpress.ru/item/1005002278422141.html?pdp_ext_f=%7B%22sku_id%22:%2212000019883782452%22,%22ship_from%22:%22CN%22%7D&gps-id=5547572&scm=1007.19201.130907.0&scm_id=1007.19201.130907.0&scm-url=1007.19201.130907.0&pvid=55f97fd7-33ad-4c94-bf50-b750cf815620","0.0","4.8"
"4001359797958","234719377","200kg Door Horizontal Bars 60-100cm Steel Adjustable Training For Home Gym Workout Sport Fitness турник Pull Up Bar Equipments","US $26.23","US $201.79","87","1259","//ae01.alicdn.com/kf/H06f8be90846b4afc834c3862be736000s.jpg_350x350.jpg","//aliexpress.ru/item/4001359797958.html?pdp_ext_f=%7B%22sku_id%22:%2210000015800521218%22,%22ship_from%22:%22CN%22%7D&gps-id=5547572&scm=1007.19201.130907.0&scm_id=1007.19201.130907.0&scm-url=1007.19201.130907.0&pvid=55f97fd7-33ad-4c94-bf50-b750cf815620","0.0","4.6"
"1005001701332003","241712437","OrangeA Women Tracksuit Letter Print Velvet 2 Piece Outfit Sweatshirt+Straight Sweatpants Matching Set Fitness Sporty Streetwear","US $24.29","US $46.71","48","4406","//ae01.alicdn.com/kf/H64ad4b69ae0545cab5a9468467ecd05dU.jpg_350x350.jpg","//aliexpress.ru/item/1005001701332003.html?pdp_ext_f=%7B%22sku_id%22:%2212000018237430970%22,%22ship_from%22:%22CN%22%7D&gps-id=5547572&scm=1007.19201.130907.0&scm_id=1007.19201.130907.0&scm-url=1007.19201.130907.0&pvid=55f97fd7-33ad-4c94-bf50-b750cf815620","0.0","4.6"
"4001365520133","238075576","2021 New Outdoor multi-function belt buckle hiking backpack nylon hanging buckle men's tactical belt accessories new keychain","US $0.99","US $19.96","95","277","//ae01.alicdn.com/kf/Hfde3376fece64fd98995fc6efe4680348.jpg_350x350.jpg","//aliexpress.ru/item/4001365520133.html?pdp_ext_f=%7B%22sku_id%22:%2212000022635915016%22,%22ship_from%22:%22CN%22%7D&gps-id=5547572&scm=1007.19201.130907.0&scm_id=1007.19201.130907.0&scm-url=1007.19201.130907.0&pvid=55f97fd7-33ad-4c94-bf50-b750cf815620","0.0","4.9"
"32999073045","237863514","LIGE Watch For Men Top Brand Luxury Waterproof 24 Hour Date Quartz Clock Brown Leather Sports WristWatch Relogio Masculino 2021","US $15.29","US $169.90","91","933","//ae01.alicdn.com/kf/H196abb6122eb4d70b6d39b3a3ee14563R.jpg_350x350.jpg","//aliexpress.ru/item/32999073045.html?pdp_ext_f=%7B%22sku_id%22:%2267011105955%22,%22ship_from%22:%22%22%7D&gps-id=5547572&scm=1007.19201.130907.0&scm_id=1007.19201.130907.0&scm-url=1007.19201.130907.0&pvid=4a2e7454-3dac-41e6-9506-4ee79ffd9703","0.0","4.8"
"1005001808944908","231389210","2021 LIGE Casual Sports Watch for Men Top Brand Luxury Military Leather Wrist Watches Mens Clocks Fashion Chronograph Wristwatch","US $16.79","US $209.90","92","711","//ae01.alicdn.com/kf/H6d652d877e7447bf85afbb3687aa94852.jpg_350x350.jpg","//aliexpress.ru/item/1005001808944908.html?pdp_ext_f=%7B%22sku_id%22:%2212000018068051744%22,%22ship_from%22:%22ES%22%7D&gps-id=5547572&scm=1007.19201.130907.0&scm_id=1007.19201.130907.0&scm-url=1007.19201.130907.0&pvid=4a2e7454-3dac-41e6-9506-4ee79ffd9703","0.0","4.8"
"1005001874079067","248219363","OUPINKE Top Luxury Women Wristwatch Automatic Mechanical Waterproof Watch Sapphire Mirror Tungsten Steel Watchstrap Lady Watches","US $189.00","US $1,350.00","86","90","//ae01.alicdn.com/kf/H78f21a4d30e4491b987f5d3fa1821e78Y.jpg_350x350.jpg","//aliexpress.ru/item/1005001874079067.html?pdp_ext_f=%7B%22sku_id%22:%2212000017981653680%22,%22ship_from%22:%22%22%7D&gps-id=5547572&scm=1007.19201.130907.0&scm_id=1007.19201.130907.0&scm-url=1007.19201.130907.0&pvid=4a2e7454-3dac-41e6-9506-4ee79ffd9703","0.0","5.0"
"1005002328712296","248285832","LIGE New Smart watch Men Heart rate Blood pressure Full touch screen sports Fitness watch Bluetooth for Android iOS smart watch","US $31.44","US $184.95","83","1671","//ae01.alicdn.com/kf/Hd85209cf0bb64c88986694a964f25a55J.jpg_350x350.jpg","//aliexpress.ru/item/1005002328712296.html?pdp_ext_f=%7B%22sku_id%22:%2212000020109396677%22,%22ship_from%22:%22ES%22%7D&gps-id=5547572&scm=1007.19201.130907.0&scm_id=1007.19201.130907.0&scm-url=1007.19201.130907.0&pvid=4a2e7454-3dac-41e6-9506-4ee79ffd9703","0.0","4.8"
"1005001780506119","237989653","ATHVOTAR Bubble Butt Women Leggings Sexy Serpentine Sport High Waist Push Up Leggings Exercise Gym Slim Fitness Legging Mujer","US $8.98","US $47.24","81","1669","//ae01.alicdn.com/kf/H58a63b7ad0d641fd96fbcf420ffbe623A.png_350x350.png","//aliexpress.ru/item/1005001780506119.html?pdp_ext_f=%7B%22sku_id%22:%2212000017566298991%22,%22ship_from%22:%22%22%7D&gps-id=5547572&scm=1007.19201.130907.0&scm_id=1007.19201.130907.0&scm-url=1007.19201.130907.0&pvid=4a2e7454-3dac-41e6-9506-4ee79ffd9703","0.0","4.7"
"32793775351","230094000","KINGSEVEN Men Vintage Aluminum Polarized Sunglasses Classic Brand Sun glasses Coating Lens Driving Eyewear For Men/Women","US $10.45","US $26.79","61","15060","//ae01.alicdn.com/kf/Ha91f0cd6bbe24280a7147cf0a2773f2dK.jpg_350x350.jpg","//aliexpress.ru/item/32793775351.html?pdp_ext_f=%7B%22sku_id%22:%2212000016479708897%22,%22ship_from%22:%22PL%22%7D&gps-id=5547572&scm=1007.19201.130907.0&scm_id=1007.19201.130907.0&scm-url=1007.19201.130907.0&pvid=4a2e7454-3dac-41e6-9506-4ee79ffd9703","0.0","4.9"
"1005001685187606","242406775","Traditional Handmade Butcher Knives Forged Cleaver Knife 7Cr17 Hammer Made Kitchen Chef Knife Meat Fish Slicing Chopping Knife","US $13.03","US $81.45","84","89","//ae01.alicdn.com/kf/Haac4bf5e1c72400791412a79913f8a51x.jpg_350x350.jpg","//aliexpress.ru/item/1005001685187606.html?pdp_ext_f=%7B%22sku_id%22:%2212000017129190435%22,%22ship_from%22:%22CN%22%7D&gps-id=5547572&scm=1007.19201.130907.0&scm_id=1007.19201.130907.0&scm-url=1007.19201.130907.0&pvid=4a2e7454-3dac-41e6-9506-4ee79ffd9703","0.0","4.9"
"1005002624842854","230099369","Mini Bluetooth Speaker Portable TWS FM Radio Wireless Speakers Music Box Bass Boombox Subwoofer TF AUX Small Cube USB for Phones","US $9.76","US $65.04","85","27","//ae01.alicdn.com/kf/H98a5072ab3af4ae98a710eab71ffd5fdH.jpg_350x350.jpg","//aliexpress.ru/item/1005002624842854.html?pdp_ext_f=%7B%22sku_id%22:%2212000021451299865%22,%22ship_from%22:%22RU%22%7D&gps-id=5547572&scm=1007.19201.130907.0&scm_id=1007.19201.130907.0&scm-url=1007.19201.130907.0&pvid=4a2e7454-3dac-41e6-9506-4ee79ffd9703","0.0","5.0"
"4000394287497","239484857","Portable Folding Pet Tent Dog House Octagonal Cage For Cat Tent Playpen Puppy Kennel Easy Operation Fence Outdoor Big Dogs House","US $12.48","US $77.98","84","2853","//ae01.alicdn.com/kf/H96b36d6790134eab9bf6a6f1d0c6e9f1F.jpg_350x350.jpg","//aliexpress.ru/item/4000394287497.html?pdp_ext_f=%7B%22sku_id%22:%2210000013524465294%22,%22ship_from%22:%22RU%22%7D&gps-id=5547572&scm=1007.19201.130907.0&scm_id=1007.19201.130907.0&scm-url=1007.19201.130907.0&pvid=4a2e7454-3dac-41e6-9506-4ee79ffd9703","0.0","4.8"
"1005001763085231","240107904","LIGE New Men Smart Watch Wristband Men Women Sport Clock Heart Rate Monitor Sleep Monitor Bluetooth Call Smartwatch for phone","US $22.49","US $124.95","82","3337","//ae01.alicdn.com/kf/Hc1da4b6f860c42e9867bfb52119a0f86H.jpg_350x350.jpg","//aliexpress.ru/item/1005001763085231.html?pdp_ext_f=%7B%22sku_id%22:%2212000020723378557%22,%22ship_from%22:%22ES%22%7D&gps-id=5547572&scm=1007.19201.130907.0&scm_id=1007.19201.130907.0&scm-url=1007.19201.130907.0&pvid=4a2e7454-3dac-41e6-9506-4ee79ffd9703","0.0","4.6"
"32826351509","222084849","YIKALAISI 925 Sterling Silver Jewelry Pearl Earrings 2019 Fine Natural Pearl jewelry 8-9mm stud Earrings For Women wholesale","US $4.25","US $25.00","83","1153","//ae01.alicdn.com/kf/HTB1gE2TTMHqK1RjSZFgq6y7JXXaz.jpg_350x350.jpg","//aliexpress.ru/item/32826351509.html?pdp_ext_f=%7B%22sku_id%22:%2210000000086634883%22,%22ship_from%22:%22CN%22%7D&gps-id=5547572&scm=1007.19201.130907.0&scm_id=1007.19201.130907.0&scm-url=1007.19201.130907.0&pvid=4a2e7454-3dac-41e6-9506-4ee79ffd9703","0.0","4.8"
"4000902967396","232794423","8In1Multifunctional Vegetable Cutter Potato Slicer Carrot Grater Kitchen Accessories Gadgets Steel Blade Kitchen Tool овощерезка","US $11.20","US $83.55","86","2565","//ae01.alicdn.com/kf/H902d58908c1d408e899b33d499cd16a7j.jpg_350x350.jpg","//aliexpress.ru/item/4000902967396.html?pdp_ext_f=%7B%22sku_id%22:%2210000010479058772%22,%22ship_from%22:%22RU%22%7D&gps-id=5547572&scm=1007.19201.130907.0&scm_id=1007.19201.130907.0&scm-url=1007.19201.130907.0&pvid=4a2e7454-3dac-41e6-9506-4ee79ffd9703","0.0","4.9"
"4000535036327","201652940","New CHEETAH Brand Men Watches Chronograph Quartz Watch Men Stainless Steel Waterproof Sports Clock Watches Business reloj hombre","US $17.59","US $219.90","92","421","//ae01.alicdn.com/kf/Hf15178614ced4dff9819821f8e8d4ba9q.jpg_350x350.jpg","//aliexpress.ru/item/4000535036327.html?pdp_ext_f=%7B%22sku_id%22:%2212000019903030087%22,%22ship_from%22:%22CN%22%7D&gps-id=5547572&scm=1007.19201.130907.0&scm_id=1007.19201.130907.0&scm-url=1007.19201.130907.0&pvid=b837da32-6de9-45f2-b67a-afc6fe53183e","0.0","4.8"
"1005002603733670","223729216","Watches for Men CRRJU Men's Fashion Black Stainless Steel Wrist Watch Waterproof Business Dress Watch for Men Relogio Masculino","US $16.79","US $209.90","92","13","//ae01.alicdn.com/kf/He426522445e742b8b5bb81cef4d688acI.jpg_350x350.jpg","//aliexpress.ru/item/1005002603733670.html?pdp_ext_f=%7B%22sku_id%22:%2212000021353689251%22,%22ship_from%22:%22%22%7D&gps-id=5547572&scm=1007.19201.130907.0&scm_id=1007.19201.130907.0&scm-url=1007.19201.130907.0&pvid=b837da32-6de9-45f2-b67a-afc6fe53183e","0.0","5.0"
"1005001505454648","240107904","LIGE 2020 New Smart Watch Women Men Heart Rate Blood Pressure Information Remind Sport Multifunctional Waterproof Smartwatch+Box","US $18.89","US $104.95","82","2082","//ae01.alicdn.com/kf/Hd4c162e4339c496aba26c407c0de93bc7.jpg_350x350.jpg","//aliexpress.ru/item/1005001505454648.html?pdp_ext_f=%7B%22sku_id%22:%2212000016385399402%22,%22ship_from%22:%22RU%22%7D&gps-id=5547572&scm=1007.19201.130907.0&scm_id=1007.19201.130907.0&scm-url=1007.19201.130907.0&pvid=b837da32-6de9-45f2-b67a-afc6fe53183e","0.0","4.6"
"1005001473729185","240430303","New LIGE men And women color screen Smart watch multifunctional sports heart Rate blood pressure IP67 waterproof smartwatch +Box","US $18.89","US $104.95","82","832","//ae01.alicdn.com/kf/Hb94870a98434444f81727e5036ac459fr.jpg_350x350.jpg","//aliexpress.ru/item/1005001473729185.html?pdp_ext_f=%7B%22sku_id%22:%2212000016268313329%22,%22ship_from%22:%22CN%22%7D&gps-id=5547572&scm=1007.19201.130907.0&scm_id=1007.19201.130907.0&scm-url=1007.19201.130907.0&pvid=b837da32-6de9-45f2-b67a-afc6fe53183e","0.0","4.6"
"4000837761152","224214684","Getspring Women Crop top For Women Sexy Crop top Summer Top Off Shoulder Short Top Crop Black White Knitting Top Woman 2020","US $10.20","US $60.00","83","716","//ae01.alicdn.com/kf/Hfaf8b70411d14828a70ccf2ac0a0072cA.jpg_350x350.jpg","//aliexpress.ru/item/4000837761152.html?pdp_ext_f=%7B%22sku_id%22:%2212000019975490853%22,%22ship_from%22:%22%22%7D&gps-id=5547572&scm=1007.19201.130907.0&scm_id=1007.19201.130907.0&scm-url=1007.19201.130907.0&pvid=b837da32-6de9-45f2-b67a-afc6fe53183e","0.0","4.8"
"1005002662806257","231389210","2021 LIGE Brand SUNKTA Women Watches Fashion Square Ladies Quartz Watch Bracelet Set Dial Simple Rose Gold Luxury Women Watches","US $14.39","US $79.95","82","334","//ae01.alicdn.com/kf/H624fee887bfc443db61ad20ee1259252g.jpg_350x350.jpg","//aliexpress.ru/item/1005002662806257.html?pdp_ext_f=%7B%22sku_id%22:%2212000021654418444%22,%22ship_from%22:%22RU%22%7D&gps-id=5547572&scm=1007.19201.130907.0&scm_id=1007.19201.130907.0&scm-url=1007.19201.130907.0&pvid=b837da32-6de9-45f2-b67a-afc6fe53183e","0.0","4.8"
"4000237954145","228486479","Baseus 65W GaN Charger Quick Charge 4.0 3.0 Type C PD USB Charger with QC 4.0 3.0 Portable Fast Charger For Laptop iPhone 12 Pro","US $19.28","US $68.86","72","14064","//ae01.alicdn.com/kf/H2e1d7df9309f4b3aa56225b4b9868f69V.jpg_350x350.jpg","//aliexpress.ru/item/4000237954145.html?pdp_ext_f=%7B%22sku_id%22:%2212000019998521717%22,%22ship_from%22:%22CN%22%7D&gps-id=5547572&scm=1007.19201.130907.0&scm_id=1007.19201.130907.0&scm-url=1007.19201.130907.0&pvid=b837da32-6de9-45f2-b67a-afc6fe53183e","0.0","4.9"
"4000689261862","221863700","Vintage Female Crown Promise ring Real 925 Sterling silver AAAAA cz Engagement Wedding Band Rings for women men Fashion Jewelry","US $4.16","US $24.50","83","29","//ae01.alicdn.com/kf/Hf712d59f354d4b79826eb2ebcc0650e1k.jpg_350x350.jpg","//aliexpress.ru/item/4000689261862.html?pdp_ext_f=%7B%22sku_id%22:%2210000006035318764%22,%22ship_from%22:%22%22%7D&gps-id=5547572&scm=1007.19201.130907.0&scm_id=1007.19201.130907.0&scm-url=1007.19201.130907.0&pvid=b837da32-6de9-45f2-b67a-afc6fe53183e","0.0","4.8"
"1005002328179667","225376530","PAGANI DESIGN 007 Mens Wrist Watches 2021 Mechanical Stainless Steel 100M Waterproof Sport Automatic Watch For Men NH35 luminous","US $125.99","US $699.95","82","85","//ae01.alicdn.com/kf/Hbb16a00417f64526aa5f040bf3bfc84bo.jpg_350x350.jpg","//aliexpress.ru/item/1005002328179667.html?pdp_ext_f=%7B%22sku_id%22:%2212000021279992814%22,%22ship_from%22:%22ES%22%7D&gps-id=5547572&scm=1007.19201.130907.0&scm_id=1007.19201.130907.0&scm-url=1007.19201.130907.0&pvid=b837da32-6de9-45f2-b67a-afc6fe53183e","0.0","4.7"
"4001289310147","243803653","Zhoutu Planetary Mixer,Stand Mixer with Stainless Steel Bowl Electric Food Mixer Kitchen Appliances Dough Food Processor Machine","US $84.83","US $498.99","83","85","//ae01.alicdn.com/kf/H3e496c05685440a4af8adcd56168e44cA.jpg_350x350.jpg","//aliexpress.ru/item/4001289310147.html?pdp_ext_f=%7B%22sku_id%22:%2212000021384941868%22,%22ship_from%22:%22PL%22%7D&gps-id=5547572&scm=1007.19201.130907.0&scm_id=1007.19201.130907.0&scm-url=1007.19201.130907.0&pvid=b837da32-6de9-45f2-b67a-afc6fe53183e","0.0","4.6"
"32967104376","220064013","DBS blyth doll icy toy ears clay toy white natural tan dark and super black skin only ears no doll","US $5.76","US $32.00","82","223","//ae01.alicdn.com/kf/H117cda31965b40a8afcea00fa60fd0398.jpg_350x350.jpg","//aliexpress.ru/item/32967104376.html?pdp_ext_f=%7B%22sku_id%22:%2266660412191%22,%22ship_from%22:%22%22%7D&gps-id=5547572&scm=1007.19201.130907.0&scm_id=1007.19201.130907.0&scm-url=1007.19201.130907.0&pvid=b837da32-6de9-45f2-b67a-afc6fe53183e","0.0","5.0"
"1005001922775555","229890389","MISSFOX Women's Watches Snake Shape Luxury Wrist Watch For Women Steel Unique Gold Quartz Ladies Watch Clock Relogio Feminino","US $20.69","US $114.95","82","788","//ae01.alicdn.com/kf/Hbde347298b8f43d692ca47cc396ad994o.jpg_350x350.jpg","//aliexpress.ru/item/1005001922775555.html?pdp_ext_f=%7B%22sku_id%22:%2212000018121583696%22,%22ship_from%22:%22CN%22%7D&gps-id=5547572&scm=1007.19201.130907.0&scm_id=1007.19201.130907.0&scm-url=1007.19201.130907.0&pvid=b837da32-6de9-45f2-b67a-afc6fe53183e","0.0","4.9"
"1005002062784795","202450145","CRRJU 2021 New Fashion Mens Watches with Stainless Steel Top Brand Luxury Sports Chronograph Quartz Watch Men Relogio Masculino","US $14.39","US $159.90","91","1309","//ae01.alicdn.com/kf/Hb59b032a62ba450281643c8aaa4d1c4dK.jpg_350x350.jpg","//aliexpress.ru/item/1005002062784795.html?pdp_ext_f=%7B%22sku_id%22:%2212000018604996625%22,%22ship_from%22:%22%22%7D&gps-id=5547572&scm=1007.19201.130907.0&scm_id=1007.19201.130907.0&scm-url=1007.19201.130907.0&pvid=3bc15a74-87d9-4b1e-9ea1-63d2685ee9be","0.0","4.7"
"4000844374994","234631229","2021 LIGE New Fashion Mens Watches Top Brand Luxury Military Quartz Watch Premium Leather Waterproof Sport Chronograph Watch Men","US $17.09","US $189.90","91","630","//ae01.alicdn.com/kf/Heccb806fe2ed4d2298398a36fd447b41G.jpg_350x350.jpg","//aliexpress.ru/item/4000844374994.html?pdp_ext_f=%7B%22sku_id%22:%2210000009129406717%22,%22ship_from%22:%22%22%7D&gps-id=5547572&scm=1007.19201.130907.0&scm_id=1007.19201.130907.0&scm-url=1007.19201.130907.0&pvid=3bc15a74-87d9-4b1e-9ea1-63d2685ee9be","0.0","4.9"
"1005002554236833","234525240","LIGE 2021 New Smart Watch Women Full Touch Screen Sport Fitness Watch IP67 Waterproof Bluetooth For Android ios smartwatch Men","US $21.24","US $124.95","83","643","//ae01.alicdn.com/kf/Hd38962ee81f84194b9952a387c3ae1d4R.jpg_350x350.jpg","//aliexpress.ru/item/1005002554236833.html?pdp_ext_f=%7B%22sku_id%22:%2212000021117322368%22,%22ship_from%22:%22CN%22%7D&gps-id=5547572&scm=1007.19201.130907.0&scm_id=1007.19201.130907.0&scm-url=1007.19201.130907.0&pvid=3bc15a74-87d9-4b1e-9ea1-63d2685ee9be","0.0","4.9"
"4001287811661","240278512","PAGANI DESIGN GMT 40mm Mechanical Wristwatch Men's Top Brand Stainless Steel Sports Waterproof Automatic Watch Relogio Masculino","US $85.26","US $473.65","82","461","//ae01.alicdn.com/kf/H7cef81bce7484f70ab4a3b4a10b57749Q.jpg_350x350.jpg","//aliexpress.ru/item/4001287811661.html?pdp_ext_f=%7B%22sku_id%22:%2212000020729393237%22,%22ship_from%22:%22CZ%22%7D&gps-id=5547572&scm=1007.19201.130907.0&scm_id=1007.19201.130907.0&scm-url=1007.19201.130907.0&pvid=3bc15a74-87d9-4b1e-9ea1-63d2685ee9be","0.0","4.7"
"1005002245548512","249388666","GEJIAN Bluetooth Call Smart Watch Men Women Smartwatch ECG Fitness Tracker Waterproof 1.69 inch touch screen For Android iOS+Box","US $26.99","US $149.95","82","981","//ae01.alicdn.com/kf/H9f966900ec7344479774e46e2c7eb57ev.jpg_350x350.jpg","//aliexpress.ru/item/1005002245548512.html?pdp_ext_f=%7B%22sku_id%22:%2212000019584091247%22,%22ship_from%22:%22CN%22%7D&gps-id=5547572&scm=1007.19201.130907.0&scm_id=1007.19201.130907.0&scm-url=1007.19201.130907.0&pvid=3bc15a74-87d9-4b1e-9ea1-63d2685ee9be","0.0","4.7"
"4001134314509","230875708","PAGANI DESIGN Men's Automatic Mechanical Wristwatch Stainless Steel Divers Watch Sapphire Glass Men Watches reloj hombre NH35","US $80.99","US $449.95","82","149","//ae01.alicdn.com/kf/H44b59d9c30384314827fd07958762bd2n.jpg_350x350.jpg","//aliexpress.ru/item/4001134314509.html?pdp_ext_f=%7B%22sku_id%22:%2212000021771330796%22,%22ship_from%22:%22ES%22%7D&gps-id=5547572&scm=1007.19201.130907.0&scm_id=1007.19201.130907.0&scm-url=1007.19201.130907.0&pvid=3bc15a74-87d9-4b1e-9ea1-63d2685ee9be","0.0","4.7"
"1005002352697382","230875360","Super Glitter Crystal Nail Art Rhinestones SS3 SS4 SS5 SS6 Flatback Clear Non Hot Fix Rhinestones Glue On Nail Art Decorations","US $0.89","US $4.96","82","612","//ae01.alicdn.com/kf/H3b0c808b5b4b4e8787d75812c7172bc3V.jpg_350x350.jpg","//aliexpress.ru/item/1005002352697382.html?pdp_ext_f=%7B%22sku_id%22:%2212000020246416886%22,%22ship_from%22:%22%22%7D&gps-id=5547572&scm=1007.19201.130907.0&scm_id=1007.19201.130907.0&scm-url=1007.19201.130907.0&pvid=3bc15a74-87d9-4b1e-9ea1-63d2685ee9be","0.0","5.0"
"1005001922451648","240148970","Furry Spring Winter Soft Hair Scrunchies Plush Elastic Hair Band Women Girls Hair ties Kawaii Hair Rubber Band Hair Accessories","US $0.30","US $1.69","82","1492","//ae01.alicdn.com/kf/Hd0a91b51e59f4acf9817e1b2711f84308.jpg_350x350.jpg","//aliexpress.ru/item/1005001922451648.html?pdp_ext_f=%7B%22sku_id%22:%2212000018120573131%22,%22ship_from%22:%22CN%22%7D&gps-id=5547572&scm=1007.19201.130907.0&scm_id=1007.19201.130907.0&scm-url=1007.19201.130907.0&pvid=3bc15a74-87d9-4b1e-9ea1-63d2685ee9be","0.0","4.8"
"1005002204269805","240559415","2021 New Big Number Men Watch Multifunction Alarm Clock 5ATM Waterproof Camouflage Sports Digital Wristwatches Relogio Masculino","US $6.29","US $34.95","82","81","//ae01.alicdn.com/kf/H5410969924ca40a293b234e47f6e91f0G.jpg_350x350.jpg","//aliexpress.ru/item/1005002204269805.html?pdp_ext_f=%7B%22sku_id%22:%2212000022883765965%22,%22ship_from%22:%22CN%22%7D&gps-id=5547572&scm=1007.19201.130907.0&scm_id=1007.19201.130907.0&scm-url=1007.19201.130907.0&pvid=3bc15a74-87d9-4b1e-9ea1-63d2685ee9be","0.0","5.0"
"1005002003185442","234440442","Hard Storage Travel Case for Electronic Shooting Earmuffs Compatible Impact Hearing Protection Shooter Safety Eyewear Glasses","US $15.29","US $84.95","82","82","//ae01.alicdn.com/kf/H5ec09dcf5fb64786bbba6a618d927361G.jpg_350x350.jpg","//aliexpress.ru/item/1005002003185442.html?pdp_ext_f=%7B%22sku_id%22:%2212000018380602923%22,%22ship_from%22:%22%22%7D&gps-id=5547572&scm=1007.19201.130907.0&scm_id=1007.19201.130907.0&scm-url=1007.19201.130907.0&pvid=3bc15a74-87d9-4b1e-9ea1-63d2685ee9be","0.0","4.9"
"1005001458123419","232935016","Queenral Plus Size Bra 3XL4XL Seamless Bras For Women Underwear BH Sexy Lace Brassiere Push Up Bralette With Pad Vest Top Bra","US $3.45","US $7.67","55","32736","//ae01.alicdn.com/kf/Hcc4282eec7d645568b26ba11b1ba7f95P.jpg_350x350.jpg","//aliexpress.ru/item/1005001458123419.html?pdp_ext_f=%7B%22sku_id%22:%2212000016192970823%22,%22ship_from%22:%22%22%7D&gps-id=5547572&scm=1007.19201.130907.0&scm_id=1007.19201.130907.0&scm-url=1007.19201.130907.0&pvid=3bc15a74-87d9-4b1e-9ea1-63d2685ee9be","0.0","4.6"
"4001043471484","231381765","Women Sandals Platform Sandals Shoes Women Bow 2020 Summer Sandals Slipper Indoor Outdoor Flip-flops Beach Shoes Female Slippers","US $10.02","US $26.37","62","8985","//ae01.alicdn.com/kf/Hc4ea1dfab004433380303c004200013aP.jpg_350x350.jpg","//aliexpress.ru/item/4001043471484.html?pdp_ext_f=%7B%22sku_id%22:%2210000013718816366%22,%22ship_from%22:%22%22%7D&gps-id=5547572&scm=1007.19201.130907.0&scm_id=1007.19201.130907.0&scm-url=1007.19201.130907.0&pvid=3bc15a74-87d9-4b1e-9ea1-63d2685ee9be","0.0","4.7"
